{
  "version": "1.5.7",
  "timestamp": "2018-08-26T21:39:29.364Z",
  "state_etag": "2a8b718",
  "points": {
    "room_temperature": {
      "value_state": "applied"
    },
    "hallway_temperature": {
      "value_state": "overridden"
    },
    "hallway_lights": {
      "value_state": "updating"
    },
    "entryway_lock": {
      "value_state": "failure",
      "status": {
        "message": "Failure to confirm point",
        "category": "pointset.point.failure",
        "timestamp": "2018-08-26T21:39:28.364Z",
        "level": 600
      }
    },
    "scale_sensor": {
      "value_state": "invalid",
      "status": {
        "message": "Point is not writable",
        "category": "pointset.point.invalid",
        "timestamp": "2018-08-26T21:39:28.364Z",
        "level": 600
      }
    },
    "rocket_motor": {
    }
  }
}
